{
  "$schema": "https://json-schema.org/draft/2020-12/schema",
  "title": "DistributionQueue",
  "type": "object",
  "required": ["version", "type", "updated_at", "items"],
  "properties": {
    "version": {"const": 1},
    "type": {"const": "distribution_queue"},
    "updated_at": {"type": "string", "format": "date-time"},
    "items": {
      "type": "array",
      "items": {
        "type": "object",
        "required": ["id", "slug", "name", "price_usd", "audience", "added_at", "status"],
        "properties": {
          "id": {"type": "string"},
          "slug": {"type": "string"},
          "name": {"type": "string"},
          "stripe_payment_link_url": {"type": "string", "format": "uri"},
          "gumroad_url": {"oneOf": [{"type": "string", "format": "uri"}, {"type": "null"}]},
          "price_usd": {"type": "integer", "minimum": 1},
          "audience": {"type": "string"},
          "added_at": {"type": "string", "format": "date-time"},
          "status": {"enum": ["ready", "distributing", "done"]}
        }
      }
    }
  }
}
