{
  "version": 1,
  "type": "distribution_queue",
  "updated_at": "2026-05-29T01:04:02Z",
  "items": [
    {
      "id": "auto-dealership-license-database-2026-05-2026-05-27",
      "slug": "auto-dealership-license-database-2026-05",
      "name": "Texas Auto Dealership License Database 2026 — 21,003 Records (CSV)",
      "stripe_payment_link_url": "https://buy.stripe.com/00w28k6KXcvdcD90ey7IY0D",
      "gumroad_url": "https://3563705146415.gumroad.com/l/osjpcr",
      "price_usd": 49,
      "audience": "CRM/DMS software vendors (CDK Global, DealerSocket, VinSolutions, Tekion, AutoRaptor) running outbound sales campaigns; automotive parts and equipment distributors targeting dealership service departments; F&I product providers (warranty companies, GAP insurance); digital marketing agencies specializing in dealership SEO/SEM; auto auction companies (Manheim, ADESA); automotive lenders and floor plan financing companies; franchise development teams.",
      "added_at": "2026-05-29T01:04:02Z",
      "status": "ready"
    },
    {
      "id": "ca-cslb-licensed-contractors-2026-05-2026-05-07",
      "slug": "ca-cslb-licensed-contractors-2026-05",
      "name": "California Licensed Contractors — CSLB Database 2026 — 232,617 Records (CSV)",
      "stripe_payment_link_url": "https://buy.stripe.com/4gMaEQb1deDlcD91iC7IY0q",
      "gumroad_url": "https://gumroad.com/l/rvzovl",
      "price_usd": 79,
      "audience": "Building material distributors, construction SaaS vendors (Procore, Buildertrend, CoConstruct SDRs), subcontractor insurance brokers, bonding companies, construction equipment rental companies, safety training providers, lien management software vendors, specialty trade CE providers.",
      "added_at": "2026-05-29T01:04:02Z",
      "status": "ready"
    },
    {
      "id": "cms-medicare-home-health-agencies-2026-05-2026-05-05",
      "slug": "cms-medicare-home-health-agencies-2026-05",
      "name": "Medicare-Certified Home Health Agencies — US Database 2026 — 12,392 Records, CSV",
      "stripe_payment_link_url": "https://buy.stripe.com/5kQcMYfhtgLtdHdgdw7IY0h",
      "gumroad_url": "https://3563705146415.gumroad.com/l/jddyts",
      "price_usd": 49,
      "audience": "Medical SaaS vendors (CRM, EVV, billing, scheduling, payroll tools for home health operators); durable medical equipment and wound-care supply reps; healthcare staffing agencies recruiting home health aides; and insurance brokers selling liability and workers comp to home health operators.",
      "added_at": "2026-05-29T01:04:02Z",
      "status": "ready"
    },
    {
      "id": "epa-tri-toxic-release-reporting-facilities-2026-05-2026-05-11",
      "slug": "epa-tri-toxic-release-reporting-facilities-2026-05",
      "name": "EPA Toxic Release Inventory 2023 — 22,000+ Reporting Facilities, Chemicals Released by Air/Water/Land (CSV)",
      "stripe_payment_link_url": "https://buy.stripe.com/14A00cd9l7aT7iP1iC7IY0u",
      "gumroad_url": "https://3563705146415.gumroad.com/l/sgmxqk",
      "price_usd": 49,
      "audience": "Sales, marketing, and data teams prospecting this vertical.",
      "added_at": "2026-05-29T01:04:02Z",
      "status": "ready"
    },
    {
      "id": "faa-civil-aircraft-registration-2026-05-2026-05-06",
      "slug": "faa-civil-aircraft-registration-2026-05",
      "name": "US Civil Aircraft Registration Database — 2026 — 302,810 Records (CSV)",
      "stripe_payment_link_url": "https://buy.stripe.com/5kQdR20mz0Mvbz5f9s7IY0l",
      "gumroad_url": "https://3563705146415.gumroad.com/l/knszdz",
      "price_usd": 69,
      "audience": "Aviation insurance brokers writing hull and liability policies for Part 91 private aircraft owners; avionics shops needing a prospecting list for ADS-B upgrades and avionics installs; MRO (maintenance, repair, overhaul) shops; aircraft parts and supply vendors; flight training schools; aviation SaaS vendors.",
      "added_at": "2026-05-29T01:04:02Z",
      "status": "ready"
    },
    {
      "id": "fdic-bank-branch-directory-2026-05-2026-05-17",
      "slug": "fdic-bank-branch-directory-2026-05",
      "name": "US Bank Branch Directory 2026 — 77,542 FDIC-Insured Branches, CSV",
      "stripe_payment_link_url": "https://buy.stripe.com/9B63co7P1an58mT4uO7IY0v",
      "gumroad_url": null,
      "price_usd": 49,
      "audience": "Fintech BD teams building bank partnership pipelines by asset size and state; commercial real estate brokers and site-selection consultants mapping bank density for retail leasing; insurance companies and ATM operators prospecting branch locations; municipal planners tracking branch deserts; data scientists needing labeled financial POI ground truth.",
      "added_at": "2026-05-29T01:04:02Z",
      "status": "ready"
    },
    {
      "id": "fl-alcoholic-beverage-licensees-2026-05-2026-05-07",
      "slug": "fl-alcoholic-beverage-licensees-2026-05",
      "name": "Florida Active Alcohol Licensees — Bars, Restaurants & Package Stores — 2026 — 52,152 Records (CSV)",
      "stripe_payment_link_url": "https://buy.stripe.com/cNi5kwglx9j10Ur0ey7IY0m",
      "gumroad_url": "https://3563705146415.gumroad.com/l/xqymyk",
      "price_usd": 49,
      "audience": "Liquor distributors and sales reps prospecting on-premise accounts; POS system vendors (Toast, Square, SpotOn) targeting hospitality; payment processors targeting bars and restaurants; linen and supply companies; music licensing reps (ASCAP, BMI, SESAC); entertainment and events vendors; insurance brokers selling liquor liability.",
      "added_at": "2026-05-29T01:04:02Z",
      "status": "ready"
    },
    {
      "id": "fl-real-estate-agent-licenses-2026-05-2026-05-06",
      "slug": "fl-real-estate-agent-licenses-2026-05",
      "name": "Florida Licensed Real Estate Agents & Brokers — 2026 Database — 448,610 Records (CSV)",
      "stripe_payment_link_url": "https://buy.stripe.com/cNi8wIb1dfHpeLhe5o7IY0k",
      "gumroad_url": "https://3563705146415.gumroad.com/l/gbkrqm",
      "price_usd": 49,
      "audience": "Real estate SaaS SDRs (Follow Up Boss, Lofty, kvCORE, Sierra Interactive), mortgage lenders sourcing agent referral partners, title insurance companies, E&O insurance brokers, continuing education providers selling real estate CE credits, and proptech companies selling transaction management or showing software to agents.",
      "added_at": "2026-05-29T01:04:02Z",
      "status": "ready"
    },
    {
      "id": "new-business-formations-csv-2026-05-2026-05-05",
      "slug": "new-business-formations-csv-2026-05",
      "name": "New Florida LLCs & Corps — May 2026 — 15,997 Records (CSV)",
      "stripe_payment_link_url": "https://buy.stripe.com/aFaaEQc5h66Pbz5f9s7IY0f",
      "gumroad_url": "https://3563705146415.gumroad.com/l/pzbfkf",
      "price_usd": 49,
      "audience": "B2B service providers who sell to brand-new small businesses: commercial insurance agents, bookkeepers, CPAs, website designers, registered agent firms, payroll processors, and business banking reps. All want to reach owners in the first 30-60 days before competitors do.",
      "added_at": "2026-05-29T01:04:02Z",
      "status": "ready"
    },
    {
      "id": "nppes-dentists-dental-practices-2026-05-2026-05-07",
      "slug": "nppes-dentists-dental-practices-2026-05",
      "name": "US Dentists & Dental Practices — NPI Database 2026 — 371,786 Records (CSV)",
      "stripe_payment_link_url": "https://buy.stripe.com/cNi9AM3yL0MvfPl0ey7IY0r",
      "gumroad_url": null,
      "price_usd": 79,
      "audience": "Dental supply companies (Patterson, Henry Schein, Benco), dental SaaS vendors (Dentrix, Eaglesoft, Carestream SDRs), dental equipment manufacturers/reps, dental lab companies, dental CE education providers, practice management consultants, dental insurance brokers, dental staffing agencies.",
      "added_at": "2026-05-29T01:04:02Z",
      "status": "ready"
    },
    {
      "id": "nppes-physical-therapist-clinics-2026-05-2026-05-07",
      "slug": "nppes-physical-therapist-clinics-2026-05",
      "name": "US Physical Therapists & PT Clinics — NPI Database 2026 — 377,805 Records (CSV)",
      "stripe_payment_link_url": "https://buy.stripe.com/6oU3co9X9br9dHd2mG7IY0n",
      "gumroad_url": "https://3563705146415.gumroad.com/l/fpxgm",
      "price_usd": 79,
      "audience": "Medical SaaS vendors selling EMR, scheduling, billing, and outcomes tracking tools to PT practices; medical equipment and supply reps (ultrasound, electrotherapy, exercise equipment); healthcare staffing agencies recruiting PTs and PTAs; liability insurance brokers; PT-focused CE providers; and outpatient rehab chains doing competitive market mapping.",
      "added_at": "2026-05-29T01:04:02Z",
      "status": "ready"
    },
    {
      "id": "samgov-small-biz-contractor-leads-2026-05-2026-05-05",
      "slug": "samgov-small-biz-contractor-leads-2026-05",
      "name": "SAM.gov Small Biz Contractor Leads — DMV IT Corridor — 4,731 Records (CSV)",
      "stripe_payment_link_url": "https://buy.stripe.com/dRm5kwb1dfHp7iPe5o7IY0g",
      "gumroad_url": "https://3563705146415.gumroad.com/l/madhdb",
      "price_usd": 49,
      "audience": "Government contracting subcontractors seeking 8(a)/HUBZone/WOSB/SDVOSB teaming partners, IT staffing agencies targeting federal-contractor clients, management consultants pursuing government market entry, and SaaS vendors (proposal software, compliance tools, timekeeping) selling to federal IT contractors.",
      "added_at": "2026-05-29T01:04:02Z",
      "status": "ready"
    },
    {
      "id": "sec-registered-investment-advisers-2026-05-2026-05-07",
      "slug": "sec-registered-investment-advisers-2026-05",
      "name": "SEC Registered Investment Adviser (RIA) Database — 2026 — 16,551 Firms (CSV)",
      "stripe_payment_link_url": "https://buy.stripe.com/bJe00c1qD7aT8mT0ey7IY0s",
      "gumroad_url": "https://gumroad.com/l/ibhcj",
      "price_usd": 79,